<?xml version="1.0" encoding="UTF-8"?>
<!-- <!DOCTYPE XML> -->
<solution-properties xmlns:xsi="http://www.w3.org/2001/XMLSchema-instance"
		xsi:noNamespaceSchemaLocation="solution.xsd">
	<log logType="info">
		<url>C:\Users\nfernandez\Desktop\Toc\02-Proyectos\01-Customs\01-Contratos\</url>
	</log>
	<databases>
		<database active="true">
			<name>AbSolution sqlite</name>
			<engine>sqlite</engine>
			<url>C:\Users\nfernandez\Desktop\Toc\02-Proyectos\01-Customs\01-Contratos\02-DataBase\databases</url>
			<databasename>AbSolution.db</databasename>
			<user></user>
			<password></password>
		</database>
	</databases>
</solution-properties>