<?xml version="1.0" encoding="UTF-8"?>
<!-- <!DOCTYPE XML> -->
<solution-properties xmlns:xsi="http://www.w3.org/2001/XMLSchema-instance"
		xsi:noNamespaceSchemaLocation="solution.xsd">
	<log logType="info">
		<url>Path</url>
	</log>
	<structure>
		<pathOfStructure>StructPath</pathOfStructure>
	</structure>
	<databases>
		<database active="true">
			<name>AbSolution sqlite</name>
			<engine>sqlite</engine>
			<url>path</url>
			<databasename>database.sdb</databasename>
			<user></user>
			<password></password>
		</database>
		<database active="false">
			<name>AbSolution sql server</name>
			<engine>sqlServer</engine>
			<url></url>
			<databasename></databasename>
			<user></user>
			<password></password>
		</database>
	</databases>
</solution-properties>